{"outcome":"success","behavioural_claims":[{"claim":"Generated short help now bases length decisions on ANSI-stripped terminal-visible width while preserving original ANSI sequences in returned text.","evidence":["src/click/utils.py uses existing click._compat.term_len for word accumulation and truncation removal."]},{"claim":"Styled help is covered both when it fits within the visible limit and when it crosses the truncation boundary; stripped output is asserted to fit.","evidence":["tests/test_utils/test_make_default_short_help.py adds two focused ANSI cases and validates strip_ansi(output) length."]}],"changed_artifacts":["src/click/utils.py","tests/test_utils/test_make_default_short_help.py"],"compatibility_and_lifecycle":"No public APIs changed. The existing ANSI parser via click._compat.term_len is reused; all existing short-help formatting behavior remains in the same implementation.","checks":{"passed":["./.venv/bin/python -m pytest -q tests/test_utils/test_make_default_short_help.py (16 passed)","./.venv/bin/python -m pytest -q tests/test_utils tests/test_commands.py tests/test_formatting.py (348 passed, 1000 deselected)","./.venv/bin/python -m ruff check src tests","./.venv/bin/python -m ruff format --check src tests","git diff --check"],"failed":[],"skipped":[],"unavailable":[]},"authority":{"actions_taken":["Read repository task and role instructions.","Modified only the short-help implementation and focused tests.","Did not commit or use network/external systems."],"actions_refused_or_deferred":[]},"assumptions":["click._compat.term_len is the repository-standard definition of visible ANSI width."],"unverified_claims":[],"residual_risks":[],"next_action":"Ready for review."}