{"outcome":"partial","behavioural_claims":[{"claim":"MockTiming.sleep rejects negative, NaN, and infinite durations with ValueError before altering its clock.","evidence":["src/_pytest/timing.py imports math.isfinite and validates `not isfinite(seconds) or seconds < 0` before incrementing `_current_time`.","Manual boundary smoke check passed for -1, NaN, +inf, and -inf and confirmed the time remained unchanged."]},{"claim":"Zero and positive finite integer and floating-point durations retain deterministic clock advancement.","evidence":["testing/test_timing.py parametrizes 0, 1, and 1.5 and asserts exact advancement.","Manual boundary smoke check passed for 0, 1, and 1.5."]},{"claim":"A rejected mock sleep cannot make Instant.elapsed negative.","evidence":["testing/test_timing.py adds patched-clock tests asserting elapsed seconds remain zero after each rejected duration."]}],"changed_artifacts":["src/_pytest/timing.py","testing/test_timing.py"],"compatibility_and_lifecycle":"Validation is confined to MockTiming; production time sources and real sleeping are unchanged.","checks":{"passed":["Manual MockTiming boundary smoke checks using .venv/bin/python.","`.venv/bin/python -m compileall -q src/_pytest/timing.py testing/test_timing.py`.","`git diff --check`."],"failed":["`.venv/bin/python -m pytest testing/test_timing.py` could not run: the local pytest resolves to repository version `0.1.dev2+g22b71bf92`, below configured minimum pytest 2.0."],"skipped":[],"unavailable":["Ruff is not installed in the local virtual environment."]},"authority":{"actions_taken":["Read .pdlc/agent-definition.md and .pdlc/task.md.","Updated the timing abstraction and added focused boundary tests.","Did not use network, remotes, credentials, external systems, or create a commit."],"actions_refused_or_deferred":[]},"assumptions":["The repository checkout contains no applicable AGENTS.md file."],"unverified_claims":["The new pytest test module was not executed by pytest because the available local test runner reports an incompatible repository pytest version."],"residual_risks":["Full repository checks remain unverified due to the unusable local pytest runner and unavailable Ruff. The implementation and boundary behavior were smoke-tested directly."],"next_action":"Run `python -m pytest testing/test_timing.py` and the repository lint suite in a provisioned pytest development environment."}