{"outcome":"partial","behavioural_claims":[{"claim":"Hook collections are now materialized and fully validated for callability before any hook is invoked.","evidence":["src/requests/hooks.py converts iterable hooks to a list, validates each indexed entry, and only then begins dispatch."]},{"claim":"A non-callable hook produces a TypeError that identifies the event and zero-based position, without running previous hooks.","evidence":["tests/test_hooks.py adds a side-effect hook before an invalid entry and asserts both the exact TypeError message and zero calls."]},{"claim":"Lists, tuples, generators, and existing single-callable behavior are covered without changing None-result behavior.","evidence":["tests/test_hooks.py parametrizes list, tuple, and generator inputs; the original single-callable/None-preserving test remains."]}],"changed_artifacts":["src/requests/hooks.py","tests/test_hooks.py"],"compatibility_and_lifecycle":"No dependency metadata changed. Valid hook exceptions remain uncaught; hook ordering and response replacement semantics are retained.","checks":{"passed":["git diff --check"],"failed":[],"skipped":[],"unavailable":["Focused pytest could not run: `python` is unavailable and `/usr/bin/python3` has no pytest installed.","Ruff could not be run because its executable is not available in PATH."]},"authority":{"actions_taken":["Read repository task and agent instructions.","Modified only local source and focused tests.","Attempted focused test and lint commands without network or external systems."],"actions_refused_or_deferred":["Did not install dependencies or use network access.","Did not commit changes."]},"assumptions":["The requested TypeError wording may be implementation-defined so long as it names the event and zero-based invalid position."],"unverified_claims":["Focused tests have not executed in this environment because pytest is missing."],"residual_risks":["Runtime behavior is unverified locally due to unavailable test tooling."],"next_action":"Run `python -m pytest tests/test_hooks.py` and `ruff check src/requests/hooks.py tests/test_hooks.py` in the repository test environment."}