{"outcome":"partial","behavioural_claims":[{"claim":"`Headers.__repr__` redacts `api-key` and `x-api-key` alongside the existing authorization headers.","evidence":["Centralized `SENSITIVE_HEADERS` policy in `httpx/_models.py` now includes both API-key names.","Added parametrized coverage for string and bytes header inputs in `tests/models/test_headers.py`." ]},{"claim":"Redaction is case-insensitive, covers repeated sensitive headers, and does not alter stored header values or public accessors.","evidence":["Focused in-environment representation assertions passed for mixed-case string/bytes names, repeated `X-API-Key`, mapping access, `raw`, `items`, and `multi_items`." ]},{"claim":"Existing non-sensitive and authorization representation behavior remains unchanged.","evidence":["Focused assertions passed for `content-type` and `authorization` representations." ]}],"changed_artifacts":["httpx/_models.py","tests/models/test_headers.py"],"compatibility_and_lifecycle":"Additive diagnostic-only change: API-key values are redacted solely in `Headers.__repr__`; stored values and access APIs are unchanged.","checks":{"passed":["`.venv/bin/ruff format httpx/_models.py tests/models/test_headers.py --diff`","`.venv/bin/ruff check httpx/_models.py tests/models/test_headers.py`","`.venv/bin/mypy httpx/_models.py tests/models/test_headers.py`","Focused local Python assertions for redaction, repeated headers, access preservation, and regression behavior","`git diff --check`"],"failed":[],"skipped":[],"unavailable":["`pytest tests/models/test_headers.py` could not collect because the local environment lacks `uvicorn`, required by `tests/conftest.py`."]},"authority":{"actions_taken":["Read repository and PDLC task instructions.","Modified only local source and focused tests.","Did not commit or access network/remotes/external systems."],"actions_refused_or_deferred":[]},"assumptions":["The existing normalized lower-case sensitive-header policy is the intended centralized policy mechanism."],"unverified_claims":[],"residual_risks":["The focused pytest module was not executed due to the missing local `uvicorn` dependency, though equivalent targeted assertions and static checks passed."],"next_action":"Install the repository test dependencies in the local environment, then run `.venv/bin/python -m pytest tests/models/test_headers.py`."}