{"outcome":"success","behavioural_claims":[{"claim":"Negative minimum and maximum widths now raise bound-specific ValueError exceptions without modifying the source Measurement.","evidence":["rich/measure.py validates negative widths before constructing a result.","tests/test_measure.py covers both methods and verifies the original Measurement remains unchanged."]},{"claim":"clamp rejects a supplied minimum greater than a supplied maximum before applying either bound.","evidence":["rich/measure.py validates both provided bounds before mutation-free chaining.","tests/test_measure.py covers inverted bounds and source immutability."]},{"claim":"Existing valid and None-based clamp behavior is retained.","evidence":["Existing test_clamp cases remain unchanged and passed."]}],"changed_artifacts":["rich/measure.py","tests/test_measure.py"],"compatibility_and_lifecycle":"normalize() semantics and dependency metadata were not changed. Measurement remains immutable; operations return new NamedTuple instances or raise before producing a result.","checks":{"passed":["./.venv/bin/python -m pytest tests/test_measure.py (7 passed)","./.venv/bin/python -m pytest (959 passed, 25 skipped)","./.venv/bin/python -m compileall -q rich/measure.py tests/test_measure.py","git diff --check"],"failed":[],"skipped":[],"unavailable":["pytest and python were not available on PATH; repository .venv was used successfully."]},"authority":{"actions_taken":["Read .pdlc/agent-definition.md and .pdlc/task.md.","Modified only local source and focused tests.","Ran local checks; no commit or external access was performed."],"actions_refused_or_deferred":["Did not use network access, Git remotes, credentials, or external systems.","Did not commit changes."]},"assumptions":["Error messages identifying a bound by 'minimum width' or 'maximum width' satisfy the requested invalid-bound identification."],"unverified_claims":[],"residual_risks":[],"next_action":"Review and commit the two modified files when ready."}