{"outcome":"partial","behavioural_claims":[{"claim":"`Measurement.with_minimum()` and `with_maximum()` now reject negative widths with bound-specific `ValueError` messages.","evidence":["Added guards in `rich/measure.py`: “minimum width must be non-negative” and “maximum width must be non-negative”.","Direct Python smoke check exercised both failure paths and verified the original measurement stayed `Measurement(20, 100)`." ]},{"claim":"`Measurement.clamp()` rejects an explicitly inverted provided range before applying either bound.","evidence":["Added an upfront `min_width > max_width` guard in `rich/measure.py`.","Direct Python smoke check verified `clamp(50, 40)` raises and leaves the source measurement unchanged."]},{"claim":"Existing valid and `None` clamp cases retain their results.","evidence":["Direct Python smoke check covered `(10, 50)`, `(30, 50)`, `(None, 50)`, `(30, None)`, and `(None, None)`." ]},{"claim":"Focused regression tests cover negative direct bounds, inverted clamp bounds, and source immutability on failure.","evidence":["Added parameterized direct-bound failure coverage and inverted-clamp coverage in `tests/test_measure.py`." ]}],"changed_artifacts":["rich/measure.py","tests/test_measure.py"],"compatibility_and_lifecycle":"No dependency metadata or `normalize()` semantics were changed. Valid clamp and `None`-bound behavior is preserved by verification; negative bounds now deliberately fail instead of producing/coercing invalid measurements. `Measurement` remains immutable.","checks":{"passed":["Direct Python smoke assertions for valid clamp cases, `None` bounds, negative direct bounds, inverted clamp bounds, exception messages, and source immutability.","`git diff --check` completed successfully."],"failed":["`python3 -m compileall -q rich/measure.py` could not write its bytecode cache due to sandbox restrictions (`PermissionError` outside the writable workspace path)."],"skipped":["Full repository test suite and type/format checks were not run because the required local commands/packages are absent."],"unavailable":["`python` command not installed.","`pytest` is unavailable (`python3: No module named pytest`).","`black` is unavailable."]},"authority":{"actions_taken":["Read `.pdlc/agent-definition.md` and `.pdlc/task.md`.","Inspected target code, focused tests, project configuration, and initial working-tree state.","Applied only local edits within the requested scope; no network, remotes, credentials, commits, or external systems used."],"actions_refused_or_deferred":["Did not install dependencies or access external systems to obtain unavailable test tooling.","Did not modify dependency metadata or `normalize()` behavior."]},"assumptions":["A negative one-bound `clamp()` call should surface the respective direct-bound validation, while the explicit two-bound inversion check takes precedence when both bounds are provided."],"unverified_claims":["The focused pytest tests and repository-wide formatter/type checks could not be run in this environment."],"residual_risks":["Local static formatting and pytest collection/execution remain unverified due to unavailable tooling."],"next_action":"Run `pytest tests/test_measure.py -q`, then the repository’s available formatting/type checks in an environment with the declared development dependencies installed."}