{"outcome":"partial","behavioural_claims":[{"claim":"MockTiming rejects negative, NaN, positive-infinite, and negative-infinite durations with a clear ValueError before changing its clock.","evidence":["`src/_pytest/timing.py` validates with `seconds < 0 or not isfinite(seconds)` and raises `ValueError(\"MockTiming.sleep() requires a finite, non-negative duration\")`.","Direct boundary assertion script passed for -1, NaN, +inf, and -inf."]},{"claim":"Rejected sleeps preserve mock time and cannot make Instant.elapsed() negative.","evidence":["Focused test added in `testing/test_pytester.py`; direct boundary assertion script confirmed unchanged clock and elapsed seconds of 0 after each rejected duration."]},{"claim":"Zero and positive finite integer and float durations retain deterministic advancement.","evidence":["Focused parametrized test added for 0, 1, and 1.5; direct boundary assertion script passed."]}],"changed_artifacts":["src/_pytest/timing.py","testing/test_pytester.py"],"compatibility_and_lifecycle":"Change is confined to the deterministic MockTiming abstraction. Real sleeping and production clock sources are unchanged. Existing valid finite non-negative durations preserve the prior addition behaviour; no migration or recovery action is required.","checks":{"passed":["`git diff --check` passed.","Direct `.venv` Python boundary assertions passed.","`PYTHONPYCACHEPREFIX=/private/tmp/pdlc-LSE-129-pycache ./.venv/bin/python -m py_compile src/_pytest/timing.py testing/test_pytester.py` passed."],"failed":["`./.venv/bin/python -m pytest testing/test_pytester.py -q -k 'mock_timing_sleep'` could not run: the checkout-local pytest identifies itself as `pytest-0.1.dev2+gfd7956d21`, below the configured minimum version."],"skipped":[],"unavailable":["Ruff unavailable: `./.venv/bin/ruff` does not exist and no system `ruff` command is installed."]},"authority":{"actions_taken":["Read `.pdlc/agent-definition.md`, `.pdlc/task.md`, implementation, and relevant tests.","Made local reversible edits only.","Ran available local validation without network, remotes, credentials, commits, or external systems."],"actions_refused_or_deferred":["Did not use network access, Git remotes, credentials, external systems, or commit the change."]},"assumptions":["No applicable `AGENTS.md` exists inside this checkout; files found in sibling directories were not applied."],"unverified_claims":["The focused pytest test file was not executed through pytest because the local environment has a broken/incompatible pytest version identity."],"residual_risks":["Repository pytest and Ruff checks require a functional project test/lint environment before merge."],"next_action":"Run `testing/test_pytester.py -k mock_timing_sleep` and the repository lint check in a provisioned pytest development environment."}