{"outcome":"partial","behavioural_claims":[{"claim":"QueryParams.remove_value(key, value) returns a new object and removes only the first coerced key/value match, preserving remaining pair order.","evidence":["Implemented in httpx/_urls.py.","Direct smoke check passed: duplicate removal yielded [('a', '456'), ('a', '123'), ('b', '789')]."]},{"claim":"Key/value coercion follows existing QueryParams rules, and missing matches return equal independent objects without mutating the source.","evidence":["Focused tests added for bool/None coercion and missing key/value independence.","Direct smoke checks passed."]},{"claim":"Existing remove, set, add, merge behavior was left unchanged.","evidence":["Diff is limited to the new method and its tests."]}],"changed_artifacts":["httpx/_urls.py","tests/models/test_queryparams.py"],"compatibility_and_lifecycle":"No encoding rules, equality semantics, dependency metadata, or existing method implementations were changed. The operation is immutable; it deep-copies parameter value lists so both changed and no-op results are independent.","checks":{"passed":["./.venv/bin/ruff check httpx/_urls.py tests/models/test_queryparams.py","./.venv/bin/mypy httpx/_urls.py","git diff --check","Direct QueryParams.remove_value smoke checks via ./.venv/bin/python"],"failed":["./.venv/bin/pytest tests/models/test_queryparams.py — test collection blocked because tests/conftest.py imports unavailable dependency uvicorn."],"skipped":[],"unavailable":["Focused pytest execution is unavailable in the provided virtual environment due to missing uvicorn."]},"authority":{"actions_taken":["Read repository and task instructions.","Made local source and test edits.","Ran local checks only."],"actions_refused_or_deferred":["Did not use network access, remotes, credentials, external systems, commits, or dependency installation."]},"assumptions":["Removing the sole remaining value deletes the key, consistent with QueryParams' internal representation."],"unverified_claims":["The focused pytest suite could not be collected in this environment, although static checks and direct smoke checks passed."],"residual_risks":["Full focused test execution remains pending until uvicorn is available in the local test environment."],"next_action":"Install or otherwise provide the repository's test dependency set locally, then run ./.venv/bin/pytest tests/models/test_queryparams.py."}